{
  "$schema": "modkit/relic@1",
  "id": "milk_frog_talisman",
  "name": {
    "zh-Hans": "奶蛙之护符",
    "en": "Milk Frog Talisman"
  },
  "artTemplate": "TalismanOfPGV",
  "trigger": "CardKeywordTrigger",
  "extraString": "milk_frog",
  "effects": [
    {
      "builtin": "gain_mana",
    "amounts": [
      1
    ],
    "color": "Void"
    }
  ],
  "addToPool": false
}
